{
  "schema": "kel-graph-change-request/0.2",
  "change_request_id": "kel:change:q1_ilt_layout:must_use_repo_plotter",
  "status": "superseded",
  "created_utc": "2026-09-13T09:20:15Z",
  "linked_experience_ids": [
    "kel:experience:edpr:q1_ilt_header_valve_branch_vertical_connector_001:20260913083159"
  ],
  "linked_feedback_ids": [
    "kel:feedback:q1_ilt_layout:must_use_repo_plotter"
  ],
  "feedback_group_id": null,
  "target_layer": "KEL",
  "change_type": "new_workflow_gate",
  "problem_observed": "The previous plot was a custom sketch and did not use the ILS plotter in the plotters folder. Future KEL layout plots must use the repository plotter/EDES/EDAS geometry when available, and any fallback sketch must be marked non-authoritative.",
  "proposed_change": "Add a KEL/LLM gate requiring EDPR/P-map/APF, EDES/EDAS/EDIKB retrieval, buildable EDAS layout JSON, builder findings, and repository plotter use before presenting design geometry.",
  "evidence_requirement": "Demonstrate one design query executed through EDPR/P-map/APF, retrieval, EDAS layout build, builder findings, and repository plotter output or explicit representability gap.",
  "priority": "medium",
  "expert_review_ref": null,
  "implementation_ref": null,
  "superseded_by": {
    "change_request_id": "kel:change:q1_ilt_layout:must_use_repo_plotter",
    "status": "implemented",
    "repo_path": "implemented/Q1_GCR_08_MUST_USE_REPO_PLOTTER.json"
  }
}
